{
  "argsDigest": "sha256:6666666666666666666666666666666666666666666666666666666666666666",
  "attemptId": "release-attempt-2",
  "chainFamily": "evm",
  "chainId": 8453,
  "contractAddress": "0x1111111111111111111111111111111111111111",
  "deadlineAt": "2026-08-27T10:05:00Z",
  "functionName": "releasePayment",
  "functionSelector": "0x12345678",
  "nonce": 42,
  "occurredAt": "2026-08-27T10:00:30Z",
  "parentRequestId": "escrow-42:delivery",
  "payloadDigest": "sha256:7777777777777777777777777777777777777777777777777777777777777777",
  "requestId": "release-escrow-42",
  "retryOfAttemptId": "release-attempt-1",
  "schemaVersion": "cgqa-smart-contract-intent-v0.1",
  "sender": "0x2222222222222222222222222222222222222222",
  "state": "PENDING",
  "traceId": "escrow-42-lifecycle"
}
